word_id,english,russian,next_repetition_date,interval_hours,ease_factor,repetitions
1634238749, back-end-loaded,с упором на конец периода,2026-01-05 18:58:38,2.5,2.5,1
1046482075, be on par with,будьте наравне с,2026-01-05 18:58:38,2.5,2.5,1
1037056975, sick leave,отпуск по болезни,2026-01-05 18:58:38,2.5,2.5,1
1124147930, we are on the cusp of monsoon season,мы находимся на пороге сезона муссонов,2026-01-05 18:58:38,2.5,2.5,1
1403750885,5% dearer,На 5% дороже,2026-01-05 18:58:38,2.5,2.5,1
1664521817,A back-end-loaded mutual fund charges fees when you sell your shares,Фонд с комиссией на выходе берет плату при продаже акций,2026-01-05 18:58:38,2.5,2.5,1
1453473280,A bird in the hand is worth two in the bush,синица в руке стоит двух в кустах,2026-01-05 18:58:38,2.5,2.5,1
18688198,A carrot and stick (approach),метод кнута и пряника,2026-01-05 18:58:38,2.5,2.5,1
1900292860,"A couple hours, tops",Максимум на пару часов,2026-01-05 18:58:38,2.5,2.5,1
1783148902,"A great relationship is not only finding the person you have fun with, but also finding the person you want to be bored with because The beauty of long-term relationships is often hidden in boring, ordinary moments","Отличные отношения заключаются не только в том, чтобы найти человека, с которым вам весело, но и в том, чтобы найти того, с кем вам будет не скучно даже в рутинные моменты. Красота долгосрочных отношений часто скрыта в скучных, обыденных моментах.",2026-01-05 18:58:38,2.5,2.5,1
1511930466,A heated argument ensued after his remark,После его замечания разгорелся жаркий спор,2026-01-06 04:36:18,12.0,2.3,0
1454017318,A heated debate ensued after the controversial decision,После этого спорного решения разгорелись жаркие дебаты,2026-01-05 19:06:18,2.5,2.5,1
1213637950,A life raft,"метафорически — как «последний шанс», «спасение»",2026-01-05 19:06:18,2.5,2.5,1
1462422743,A rakish grin spread across his face,"На его лице появилась озорная, чуть развратная ухмылка",2026-01-05 19:06:18,2.5,2.5,1
1897417715,A small leak will sink a great ship. Benjamin Franklina.,Маленькая течь топит большой корабль. Бе́нджамин Франклин.,2026-01-05 19:06:18,2.5,2.5,1
1279912630,ATTENTION WHORE,"человек, которые постоянно пытается привлечь к себе внимание",2026-01-05 19:06:18,2.5,2.5,1
1328338209,Actuarial analysis shows the pension fund is underfunded,"Актуарный (статистический, оценочный) анализ показывает, что пенсионный фонд недофинансирован",2026-01-05 19:06:18,2.5,2.5,1
1770669223,Addressable Market,Целевой Рынок,2026-01-05 19:06:18,2.5,2.5,1
2155,Afar,издалека,2026-01-05 19:06:18,2.5,2.5,1
1735648856,"After losing his job, he learned how cold the floor can be","Потеряв работу, он узнал, каким холодным может быть пол",2026-01-05 19:06:18,2.5,2.5,1
1702864797,"After the long negotiations, I felt like my threads were stripped",После долгих переговоров я чувствовал себя полностью вымотанным,2026-01-05 15:31:15,12.0,2.5,0
1102580107,"After the scandal, the investor turned off the tap",После скандала инвестор перекрыл кран,2026-01-05 15:31:15,12.0,2.5,0
1821399684,"After trying our new menu, we trust you will experience similar satisfaction as our regular customer","Мы надеемся, что, попробовав наше новое меню, вы испытаете такое же удовлетворение, как и наш постоянный клиент",2026-01-05 15:31:15,12.0,2.5,0
1246213493,"After years of trying to fix the project, he finally threw in the towel",После многих лет попыток исправить проект он наконец сдался,2026-01-05 15:31:15,12.0,2.5,0
1950573227,All our efforts came to nought,Все наши усилия ни к чему не привели,2026-01-05 15:31:15,12.0,2.5,0
2628,Aloft,в воздухе; ввысь,2026-01-05 15:31:15,12.0,2.5,0
1732506469,And what are the main risks that you see in this strategy,"И каковы основные риски, которые вы видите в этой стратегии?",2026-01-05 15:31:15,12.0,2.5,0
1322385913,Any suggestions you care to make concerning this case will be much appreciated,"Будем очень признательны за любые предложения, которые вы захотите сделать по этому делу.",2026-01-05 15:31:15,12.0,2.5,0
1828979707,Any way we can let this slide,"Есть какой-нибудь способ, которым мы можем это уладить?",2026-01-05 15:31:15,12.0,2.5,0
1389416763,"Apologies, but I won't be able to make it this Friday","Прошу прощения, но я не смогу прийти в эту пятницу",2026-01-05 15:31:15,12.0,2.5,0
1108742565,As alluded to above,Как указано выше,2026-01-05 15:31:15,12.0,2.5,0
1448186264,As if on cue,как по команде,2026-01-05 15:31:15,12.0,2.5,0
1685870221,As noted earlier,как отмечалось ранее,2026-01-05 15:31:15,12.0,2.5,0
1575098323,"As the old adage goes, “Actions speak louder than words'","Как гласит старая пословица, “Действия говорят громче слов'",2026-01-05 15:31:15,12.0,2.5,0
1545740775,"As the team leader, the buck stops with me","Как руководитель группы, ответственность лежит на мне",2026-01-05 15:31:15,12.0,2.5,0
1032472938,"At a price of 100 USD, they also represent the finest value on the market for the goods of this type",Их цена в 100$ наиболее конкурентоспособна по сравнению с ценами на другие товары подобного вида,2026-01-05 15:31:15,12.0,2.5,0
2137227455,At press time,на момент выхода из печати,2026-01-05 15:31:15,12.0,2.5,0
382399,At the eleventh hour,В последнюю минуту,2026-01-05 15:31:15,12.0,2.5,0
1869506288,At the pinnacle of sth,на вершине чего-либо,2026-01-05 15:31:15,12.0,2.5,0
1750876367,"At your earliest convenience, please share your thoughts on the offer I presented","При первом удобном случае, пожалуйста, поделитесь своими мыслями о предложении, которое я представил",2026-01-05 15:31:15,12.0,2.5,0
161,Aussie,австралиец; австралийка (сокр. от Australian),2026-01-05 15:31:15,12.0,2.5,0
1244454745,B.Y.O.B,"Bring Your Own Bottle — так пишут иногда в конце приглашении на вечеринку, сродни нашему К.П.С.С.—каждый приносит с собой; или К.П.Б.— каждый приносит бутылку.; Bring Your Own Bottle — так пишут иногда в конце приглашении на вечеринку, сродни нашему: К.П.С.С.—каждый приносит с собой; или К.П.Б.— каждый приносит бутылку.",2026-01-05 15:31:15,12.0,2.5,0
1262233434,Ball someone out,"раскритиковать или отчитать кого-то за ошибку, провинность или неосторожность",2026-01-05 15:31:15,12.0,2.5,0
126245,Band-Aid,амер. пластырь временное решение проблемы,2026-01-05 15:31:15,12.0,2.5,0
1181544637,Bass Strait,пролив Басса,2026-01-05 15:31:15,12.0,2.5,0
1425266701,Bay of Biscay,Бискайский залив,2026-01-05 15:31:15,12.0,2.5,0
17028326,Be cheerful and smiling under all circumstances. Saying.,Радуйтесь и улыбайтесь перед лицом любых обстоятельств. Поговорка.,2026-01-05 15:31:15,12.0,2.5,0
1447079498,"Before buying, quote prices from multiple vendors",Перед покупкой уточните цены у нескольких поставщиков,2026-01-05 15:31:15,12.0,2.5,0
2062868888,"Before the sales presentation, she took a few hours to acquaint herself with the new products","Перед презентацией она потратила несколько часов на то, чтобы ознакомиться с новыми продуктами",2026-01-05 15:31:15,12.0,2.5,0
1795036962,"Before you complain about the design, taste the soup","Прежде чем жаловаться на дизайн, сам попробуй — пойми, в чём дело",2026-01-05 15:31:15,12.0,2.5,0
1708307415,Belly-to-belly selling is still the most effective method,Прямые продажи по-прежнему остаются самым эффективным методом,2026-01-05 15:31:15,12.0,2.5,0
2016776558,Bezel,Обрамление (экран телефона),2026-01-05 15:31:15,12.0,2.5,0
5178,Bine,бот. побег,2026-01-05 15:31:15,12.0,2.5,0
1104602006,Bites your arm off,он откусит тебе руку - очень хочет,2026-01-05 15:31:15,12.0,2.5,0
1591266368,Blow (someone/something) out of the water,"полностью уничтожить, разгромить, превзойти или опровергнуть что-то с ошеломляющим эффектом",2026-01-05 15:31:15,12.0,2.5,0
5651,Bogus,амер. поддельный,2026-01-05 15:31:15,12.0,2.5,0
360941,Boiler Room,котельная; контора по продаже незарегистрированных ценных бумаг,2026-01-05 15:31:15,12.0,2.5,0
126990,Boolean,логический,2026-01-05 15:31:15,12.0,2.5,0
5821,Borderless,"не имеющий границ; бесконечный, нескончаемый",2026-01-05 15:31:15,12.0,2.5,0
71155,Breathlessly,затаив дыхание,2026-01-05 15:31:15,12.0,2.5,0
199144,Bullwhip,хлыст,2026-01-05 15:31:15,12.0,2.5,0
1300308077,Bushido involves being ready to give up your life rather than act dishonorably or against your principles,"Бусидо предполагает готовность скорее расстаться со своей жизнью, чем поступить бесчестно или вопреки своим принципам",2026-01-05 15:31:15,12.0,2.5,0
1481357389,"Bushido is about controlling your emotions and being disciplined, like a warrior but also being good at peaceful activities","Бусидо - это умение контролировать свои эмоции и быть дисциплинированным, как воин, но также быть хорошим в мирной деятельности",2026-01-05 15:31:15,12.0,2.5,0
1628542865,"Bushido is following a set of rules about bravery, respect, and honesty, much like the Japanese samurai did","Бусидо следует набору правил о храбрости, уважении и честности, во многом похожим на то, что делали японские самураи",2026-01-05 15:31:15,12.0,2.5,0
1620443333,Bushido is putting honor and doing the right thing above your own needs,Бусидо ставит честь и правильные поступки выше ваших собственных потребностей,2026-01-05 15:31:15,12.0,2.5,0
1766730622,"Bushido means always trying to be fair and just, making ethical choices","Бусидо означает всегда стараться быть честным, принимать этические решения",2026-01-05 15:31:15,12.0,2.5,0
1614877986,But someone maxed out my credit card,Но кто-то опустошил мою кредитную карту,2026-01-05 15:31:15,12.0,2.5,0
1334211374,"By a show of hands, how many of you have been here before","Поднимите руки, кто из вас был здесь раньше",2026-01-05 15:31:15,12.0,2.5,0
1726221109,"By and large, the meeting went well","В целом, встреча прошла хорошо",2026-01-05 15:31:15,12.0,2.5,0
1693634517,"By participating in our exclusive networking event, your company could greatly benefit from the invaluable contacts and partnerships formed","Приняв участие в нашем эксклюзивном сетевом мероприятии, ваша компания могла бы извлечь большую пользу из сформировавшихся бесценных контактов и партнерских отношений",2026-01-05 15:31:15,12.0,2.5,0
1707518029,Bye for now then,до свидания,2026-01-05 15:31:15,12.0,2.5,0
1866282896,CONCATENATE,связывать,2026-01-05 15:31:15,12.0,2.5,0
1917132132,Call me coach,"метафорически: «считай меня экспертом», «я тебя научу», «я покажу, как делать правильно»",2026-01-05 15:31:15,12.0,2.5,0
1426914227,Can I ask who is calling?,"Могу я спросить, кто звонит?",2026-01-05 15:31:15,12.0,2.5,0
1071466676,"Can I have the Accounts Department, please?","Могу я связаться с бухгалтерией, пожалуйста?",2026-01-05 15:31:15,12.0,2.5,0
1002373894,"Can I have your name, please?","Могу я узнать ваше имя, пожалуйста?",2026-01-05 15:31:15,12.0,2.5,0
1318173690,Can I make an appointment with Mr Globe?,Я хотел бы назначить встречу с г-ном Глобом,2026-01-05 15:31:15,12.0,2.5,0
1588250798,Can you clue me up on what’s going on,"Не могли бы вы объяснить мне, что происходит",2026-01-05 15:31:15,12.0,2.5,0
1697428471,"Can you put me through to the After Sales, please?","Не могли бы вы соединить меня с отделом послепродажного обслуживания, пожалуйста?",2026-01-05 15:31:15,12.0,2.5,0
1408393240,Can you use your pull to get us a table at that restaurant,"Ты можешь воспользоваться своим влиянием, чтобы заказать нам столик в том ресторане",2026-01-05 15:31:15,12.0,2.5,0
2019397926,Changes to the privacy policy will be effective as from June 15th,Изменения в политике конфиденциальности вступают в силу с 15 июня,2026-01-05 15:31:15,12.0,2.5,0
1745521050,Clarity becomes your North Star during chaos,Ясность становится твоим ориентиром в хаосе,2026-01-05 15:31:15,12.0,2.5,0
1912720847,Closing thoughts,заключительная мысль,2026-01-05 15:31:15,12.0,2.5,0
1086901115,Clothespin,прищепка,2026-01-05 15:31:15,12.0,2.5,0
1614770013,Clunky,неуклюжий,2026-01-05 15:31:15,12.0,2.5,0
12195675,Coffee? If it is no bother.,Кофе? Если не трудно.,2026-01-05 15:31:15,12.0,2.5,0
6191282,Come on. Let's get this over with.,Давай закончим с этим делом,2026-01-05 15:31:15,12.0,2.5,0
1600699445,Come with strings attached,"иметь скрытые условия, обязательства или подвох",2026-01-05 15:31:15,12.0,2.5,0
59985,Conditionally,условно,2026-01-05 15:31:15,12.0,2.5,0
1497911532,Contango,"ситуация, когда цены фьючерсов выше, чем текущая (спот) цена актива",2026-01-05 15:31:15,12.0,2.5,0
1893579179,Contemplator,созерцатель,2026-01-05 15:31:15,12.0,2.5,0
1699383393,Conversely,Наоборот,2026-01-05 15:31:15,12.0,2.5,0
172013,Corpsman,санитар (в войсках или на флоте),2026-01-05 15:31:15,12.0,2.5,0
1326850041,"Could I check the number, please?","Могу я проверить номер, пожалуйста?",2026-01-05 15:31:15,12.0,2.5,0
1879525595,"Could I speak to Mrs Bales, please?","Могу я поговорить с миссис Бейлс, пожалуйста?",2026-01-05 15:31:15,12.0,2.5,0
1875579151,Could you please repeat that?,Не могли бы вы повторить это?,2026-01-05 15:31:15,12.0,2.5,0
1018140465,Could you please send us the invoice together with the delivery note,Не могли бы вы отправить нам счет-фактуру вместе с накладной,2026-01-05 15:31:15,12.0,2.5,0
1709737087,Could you please tell me how to apply for this card,"Не могли бы вы, пожалуйста, подсказать мне, как подать заявку на получение этой карты",2026-01-05 15:31:15,12.0,2.5,0
1645948748,"Could you speak a little slower, please?","Не могли бы вы говорить немного медленнее, пожалуйста?",2026-01-05 15:31:15,12.0,2.5,0
1020443319,Daedalian complications,"хитроумные, запутанные, сложные до головоломности осложнения",2026-01-05 15:31:15,12.0,2.5,0
56732,Dea,Drug Enforcement Administration; Управление по борьбе с наркотиками (в США),2026-01-05 15:31:15,12.0,2.5,0
11517,Deliverance,освобождение,2026-01-05 15:31:15,12.0,2.5,0
2043298972,Demand decreased in response to a hike in prices,Спрос уменьшился в ответ на рост цен,2026-01-05 15:31:15,12.0,2.5,0
49855,Demeanor,манера вести себя,2026-01-05 15:31:15,12.0,2.5,0
1701353420,Do you have other teams that you have already invested in,"Есть ли у вас другие команды, в которые вы уже инвестировали?",2026-01-05 15:31:15,12.0,2.5,0
1071964604,Do you only work with private companies or also perform contracts for government institutions,Вы работаете только с частными компаниями или также выполняете контракты для государственных учреждений?,2026-01-05 15:31:15,12.0,2.5,0
12195381,Do you want me to help you? You bet!,"Ты хочешь, чтобы я помог тебе? Еще спрашиваешь!",2026-01-05 15:31:15,12.0,2.5,0
2046158059,Do you want to hold on or would you like to call back later?,Вы хотите подождать или хотели бы перезвонить позже?,2026-01-05 15:31:15,12.0,2.5,0
1220313225,Don't act like a bull in a china shop,Не веди себя как слон в посудной лавке,2026-01-05 15:31:15,12.0,2.5,0
1660641791,Don't be a dog in the manger,Не будь собакой на сене,2026-01-05 15:31:15,12.0,2.5,0
17028316,"Don't cry because it's over, smile because it happened. Dr. Seuss.","Не плачь потому что это закончилось, улыбнись потому что это было. Доктор Сеусс.",2026-01-05 15:31:15,12.0,2.5,0
6191219,"Don't worry, I can make it on my own.","He волнуйтесь, я сам справлюсь.",2026-01-05 15:31:15,12.0,2.5,0
1759279769,Don’t be a pushover — stand your ground,Не будь тряпкой — отстаивай своё,2026-01-05 15:31:15,12.0,2.5,0
1191510876,Don’t just sling your clothes on the floor,Не бросайте свою одежду просто так на пол,2026-01-05 15:31:15,12.0,2.5,0
2055751317,Don’t lie — I’m on to you,Не лги — я тебя раскусил,2026-01-05 15:31:15,12.0,2.5,0
46826,Dork,придурок,2026-01-05 15:31:15,12.0,2.5,0
200197,Douchebag,подонок,2026-01-05 15:31:15,12.0,2.5,0
13210,Downright,совершенно,2026-01-05 15:31:15,12.0,2.5,0
1813498007,Drat! I forgot my wallet at home,Черт! Я забыл свой кошелек дома,2026-01-05 15:31:15,12.0,2.5,0
1853623366,"Drink because you are happy, but never because you are miserable","Пейте от того, что вы счастливы, и никогда - потому что несчастны",2026-01-05 15:31:15,12.0,2.5,0
46851,Drippy,Противный,2026-01-05 15:31:15,12.0,2.5,0
298399,Dumbass,тупица,2026-01-05 15:31:15,12.0,2.5,0
437,Dutch,нидерландский; голландский,2026-01-05 15:31:15,12.0,2.5,0
1166557113,Elicit envy,Вызывать зависть,2026-01-05 15:31:15,12.0,2.5,0
1387375868,Enoch,библ. Енох,2026-01-05 15:31:15,12.0,2.5,0
1934827959,Enterprise Resource Planning,планирование ресурсов предприятия (ERP),2026-01-05 15:31:15,12.0,2.5,0
189095,Ever since,с тех пор как; с того времени как,2026-01-05 15:31:15,12.0,2.5,0
2071661846,"Ever since our argument, she's been icing me out","С тех пор как мы поссорились, она выводит меня из себя",2026-01-05 15:31:15,12.0,2.5,0
2008742169,"Everyone was invited, bar none","Были приглашены все, без исключения",2026-01-05 15:31:15,12.0,2.5,0
17028320,Everything you can imagine is real. Pablo Picasso.,"Всё, что ты можешь вообразить — реально. Пабло Пикассо.",2026-01-05 15:31:15,12.0,2.5,0
14943,Excel,превосходить,2026-01-05 15:31:15,12.0,2.5,0
2047117034,"Extension 123, please","Добавочный номер 123, пожалуйста",2026-01-05 15:31:15,12.0,2.5,0
283580,FFS,"for fuck's sake, черт побери",2026-01-05 15:31:15,12.0,2.5,0
15409,Fairly,"весьма, довольно",2026-01-05 15:31:15,12.0,2.5,0
1239865496,Fake it till you make it,"Притворяйся, пока не добьешься своего",2026-01-05 15:31:15,12.0,2.5,0
1709721888,Fall on deaf ears,остаться без внимания; не быть услышанным,2026-01-05 15:31:15,12.0,2.5,0
16251,Flair,вкус,2026-01-05 15:31:15,12.0,2.5,0
1011531523,For any urgent enquiries you may contact our operations and IT support teams in your relevant tech support groups on either Telegram or Skype for immediate assistance,По любым срочным вопросам вы можете обратиться за немедленной помощью к нашим специалистам по эксплуатации и ИТ-поддержке в соответствующих группах технической поддержки в Telegram или Skype,2026-01-05 15:31:15,12.0,2.5,0
1416400068,For fucks sake,какого хера,2026-01-05 15:31:15,12.0,2.5,0
1945565229,For the loo,В туалет,2026-01-05 15:31:15,12.0,2.5,0
16719,Foremost,Прежде всего,2026-01-05 15:31:15,12.0,2.5,0
192588,French fries,картофель фри,2026-01-05 15:31:15,12.0,2.5,0
809688,From dawn to dusk,От рассвета до заката,2026-01-05 15:31:15,12.0,2.5,0
1680700024,Fuck me sideways,"«Ебать», «Вот это поворот», «Ну ни хуя себе»",2026-01-05 15:31:15,12.0,2.5,0
1301155997,Fucked-off client,очень злой или раздражённый клиент,2026-01-05 15:31:15,12.0,2.5,0
1471542107,Get a load of this,ты прикинь - when you want sbd 2 pay attention 2 sth exciting&intresti,2026-01-05 15:31:15,12.0,2.5,0
1775529286,Get evicted,получить выселение,2026-01-05 15:31:15,12.0,2.5,0
1412712016,Get old,устаревать; надоедать,2026-01-05 15:31:15,12.0,2.5,0
4975243,Get out of my way.,Уйди с дороги.,2026-01-05 15:31:15,12.0,2.5,0
17028330,"Go ahead, make my day! Sudden Impact (movie).","Давай, развесели меня! Внезапный удар (фильм).",2026-01-05 15:31:15,12.0,2.5,0
230870,Go around,распространяться,2026-01-05 15:31:15,12.0,2.5,0
1224410472,Good contacts give you a leg up in business,Хорошие контакты помогут вам продвинуться в бизнесе,2026-01-05 15:31:15,12.0,2.5,0
1208168178,Gulf of Carpentaria,залив Карпентария,2026-01-05 15:31:15,12.0,2.5,0
2032535889,Guzzler,обжора,2026-01-05 15:31:15,12.0,2.5,0
174098,Halfheartedly,неохотно,2026-01-05 15:31:15,12.0,2.5,0
196002,Hand over,передавать,2026-01-05 15:31:15,12.0,2.5,0
1709046337,Handling objections,Обработка возражений,2026-01-05 15:31:15,12.0,2.5,0
17028327,Happiness is not a destination. It is a method of life. Anonymous.,"Счастье —  это не цель, а образ жизни. Неизвестный автор.",2026-01-05 15:31:15,12.0,2.5,0
54969,Hardwire,выполнять проводное соединение,2026-01-05 15:31:15,12.0,2.5,0
1778861848,Have you attended Web Summit in the past,Посещали ли вы веб-саммит в прошлом?,2026-01-05 15:31:15,12.0,2.5,0
1868097321,Have you had the opportunity to review the details of our proposal,Была ли у вас возможность ознакомиться с деталями нашего предложения,2026-01-05 15:31:15,12.0,2.5,0
1513190882,Have you previously launched any similar projects,Запускали ли вы ранее какие-либо подобные проекты?,2026-01-05 15:31:15,12.0,2.5,0
